mysql> create table members(
    -> member_id int primary key,
    -> member_name varchar(30),
    -> member_address varchar(50),
    -> acc_open_date date,
    -> membership_type varchar(20) check (membership_type in ("Lifetime","Annual","Half Yearly","Quarterly")),
    -> fees_paid int,
    -> max_books_allowed int,
    -> penalty_amount decimal(7,2)
    -> );
Query OK, 0 rows affected (0.07 sec)

mysql> create table books(
    -> book_no int,
    -> book_name varchar(30),
    -> author_name varchar(30),
    -> cost decimal(7,2),
    -> category char(10)
    -> );
Query OK, 0 rows affected (0.07 sec)

mysql> create table issue(
    -> lib_issue_id int,
    -> book_no int,
    -> member_id int,
    -> issue_date date,
    -> return_date date
    -> );
Query OK, 0 rows affected (0.03 sec)

mysql> desc members;
+-------------------+--------------+------+-----+---------+-------+
| Field             | Type         | Null | Key | Default | Extra |
+-------------------+--------------+------+-----+---------+-------+
| member_id         | int          | NO   | PRI | NULL    |       |
| member_name       | varchar(30)  | YES  |     | NULL    |       |
| member_address    | varchar(50)  | YES  |     | NULL    |       |
| acc_open_date     | date         | YES  |     | NULL    |       |
| membership_type   | varchar(20)  | YES  |     | NULL    |       |
| fees_paid         | int          | YES  |     | NULL    |       |
| max_books_allowed | int          | YES  |     | NULL    |       |
| penalty_amount    | decimal(7,2) | YES  |     | NULL    |       |
+-------------------+--------------+------+-----+---------+-------+
8 rows in set (0.00 sec)

mysql> desc books;
+-------------+--------------+------+-----+---------+-------+
| Field       | Type         | Null | Key | Default | Extra |
+-------------+--------------+------+-----+---------+-------+
| book_no     | int          | YES  |     | NULL    |       |
| book_name   | varchar(30)  | YES  |     | NULL    |       |
| author_name | varchar(30)  | YES  |     | NULL    |       |
| cost        | decimal(7,2) | YES  |     | NULL    |       |
| category    | char(10)     | YES  |     | NULL    |       |
+-------------+--------------+------+-----+---------+-------+
5 rows in set (0.00 sec)

mysql> desc issue;
+--------------+------+------+-----+---------+-------+
| Field        | Type | Null | Key | Default | Extra |
+--------------+------+------+-----+---------+-------+
| lib_issue_id | int  | YES  |     | NULL    |       |
| book_no      | int  | YES  |     | NULL    |       |
| member_id    | int  | YES  |     | NULL    |       |
| issue_date   | date | YES  |     | NULL    |       |
| return_date  | date | YES  |     | NULL    |       |
+--------------+------+------+-----+---------+-------+
5 rows in set (0.00 sec)

mysql> drop table members;
Query OK, 0 rows affected (0.06 sec)

mysql> create table members(
    -> member_id int primary key,
    -> member_name varchar(30),
    -> member_address varchar(50),
    -> acc_open_date date,
    -> membership_type varchar(20) check (membership_type in ("Lifetime","Annual","Half Yearly","Quarterly")),
    -> fees_paid int,
    -> max_books_allowed int,
    -> penalty_amount decimal(7,2)
    -> );
Query OK, 0 rows affected (0.03 sec)

mysql> alter table members
    -> modify column member_name varchar(50);
Query OK, 0 rows affected (0.02 sec)
Records: 0  Duplicates: 0  Warnings: 0

mysql> alter table issue
    -> add column reference char(30);
Query OK, 0 rows affected (0.08 sec)
Records: 0  Duplicates: 0  Warnings: 0

mysql> alter table issue
    -> drop column reference;
Query OK, 0 rows affected (0.09 sec)
Records: 0  Duplicates: 0  Warnings: 0

mysql> alter table issue rename to lib_issue;
Query OK, 0 rows affected (0.02 sec)

mysql> insert into members(
    -> ;
ERROR 1064 (42000): You have an error in your SQL syntax; check the manual that corresponds to your MySQL server version for the right syntax to use near '' at line 1
mysql> insert into members
    -> values (1,"Richa Sharma","Pune","2025-12-10","Lifetime",25000,5,50),
    -> (2,"Garima Sen","Pune","Current Date","Annual",1000,3,null);
ERROR 1292 (22007): Incorrect date value: 'Current Date' for column 'acc_open_date' at row 2
mysql> insert into members
    -> values (1,"Richa Sharma","Pune","2025-12-10","Lifetime",25000,5,50),
    -> (2,"Garima Sen","Pune",curdate(),"Annual",1000,3,null);
Query OK, 2 rows affected (0.00 sec)
Records: 2  Duplicates: 0  Warnings: 0

mysql> INSERT INTO members VALUES
    -> (3, 'Alice Johnson', '123 Maple St, Springfield', '2023-01-15', 'Lifetime', 1000, 10, 0.00),
    -> (4, 'Bob Smith', '456 Oak Ave, Shelbyville', '2024-03-22', 'Annual', 300, 5, 15.50),
    -> (5, 'Cathy Brown', '789 Pine Rd, Ogdenville', '2023-07-09', 'Half Yearly', 150, 7, 5.00),
    -> (6, 'David Wilson', '321 Elm St, Capital City', '2025-02-10', 'Quarterly', 75, 3, 0.00),
    -> (7, 'Emma Davis', '654 Cedar Blvd, North Haverbrook', '2022-11-05', 'Lifetime', 1000, 12, 20.00);
Query OK, 5 rows affected (0.01 sec)
Records: 5  Duplicates: 0  Warnings: 0

mysql> alter table members
    -> modify column member_name varchar(20);
Query OK, 7 rows affected (0.12 sec)
Records: 7  Duplicates: 0  Warnings: 0

mysql> insert into members
    -> values (8,"Yashh","Satara",curdate(),"Lifetime",30000,110,60);
Query OK, 1 row affected (0.01 sec)

mysql> create table member101(
    -> member_id int primary key,
    -> member_name varchar(30),
    -> member_address varchar(50),
    -> acc_open_date date,
    -> membership_type varchar(20) check (membership_type in ("Lifetime","Annual","Half Yearly","Quarterly")),
    -> fees_paid int,
    -> max_books_allowed int,
    -> penalty_amount decimal(7,2)
    -> );
Query OK, 0 rows affected (0.08 sec)

mysql> select * from member101;
Empty set (0.00 sec)
mysql> alter table member
    -> add constraint chk_limit check (max_books_allowed < 100 and penalty_amount <= 1000);
ERROR 1146 (42S02): Table 'sqlassignment.member' doesn't exist
mysql> alter table members
    -> add constraint chk_limit check (max_books_allowed < 100 and penalty_amount <= 1000);
ERROR 3819 (HY000): Check constraint 'chk_limit' is violated.
mysql> select * from members;
+-----------+---------------+----------------------------------+---------------+-----------------+-----------+-------------------+----------------+
| member_id | member_name   | member_address                   | acc_open_date | membership_type | fees_paid | max_books_allowed | penalty_amount |
+-----------+---------------+----------------------------------+---------------+-----------------+-----------+-------------------+----------------+
|         1 | Richa Sharma  | Pune                             | 2025-12-10    | Lifetime        |     25000 |                 5 |          50.00 |
|         2 | Garima Sen    | Pune                             | 2025-11-07    | Annual          |      1000 |                 3 |           NULL |
|         3 | Alice Johnson | 123 Maple St, Springfield        | 2023-01-15    | Lifetime        |      1000 |                10 |           0.00 |
|         4 | Bob Smith     | 456 Oak Ave, Shelbyville         | 2024-03-22    | Annual          |       300 |                 5 |          15.50 |
|         5 | Cathy Brown   | 789 Pine Rd, Ogdenville          | 2023-07-09    | Half Yearly     |       150 |                 7 |           5.00 |
|         6 | David Wilson  | 321 Elm St, Capital City         | 2025-02-10    | Quarterly       |        75 |                 3 |           0.00 |
|         7 | Emma Davis    | 654 Cedar Blvd, North Haverbrook | 2022-11-05    | Lifetime        |      1000 |                12 |          20.00 |
|         8 | Yashh         | Satara                           | 2025-11-07    | Lifetime        |     30000 |               110 |          60.00 |
+-----------+---------------+----------------------------------+---------------+-----------------+-----------+-------------------+----------------+
8 rows in set (0.00 sec)

mysql> select * from members
    -> delete where member_name = "Yashh";
ERROR 1064 (42000): You have an error in your SQL syntax; check the manual that corresponds to your MySQL server version for the right syntax to use near 'delete where member_name = "Yashh"' at line 2
mysql> delete from members
    -> where member_name = "Yashh";
Query OK, 1 row affected (0.06 sec)

mysql> alter table members
    -> add constraint chk_limit check (max_books_allowed < 100 and penalty_amount <= 1000);
Query OK, 7 rows affected (0.06 sec)
Records: 7  Duplicates: 0  Warnings: 0

mysql> desc books;
+-------------+--------------+------+-----+---------+-------+
| Field       | Type         | Null | Key | Default | Extra |
+-------------+--------------+------+-----+---------+-------+
| book_no     | int          | YES  |     | NULL    |       |
| book_name   | varchar(30)  | YES  |     | NULL    |       |
| author_name | varchar(30)  | YES  |     | NULL    |       |
| cost        | decimal(7,2) | YES  |     | NULL    |       |
| category    | char(10)     | YES  |     | NULL    |       |
+-------------+--------------+------+-----+---------+-------+
5 rows in set (0.00 sec)

mysql> drop table books;
Query OK, 0 rows affected (0.07 sec)

mysql> create table books(
    -> book_no int primary key,
    -> book_name varchar(30) not null,
    -> author_name varchar(30),
    -> cost decimal(7,2),
    -> category char(10) check ("System","Fiction","Database","RDBMS","Others")
    -> );
ERROR 1064 (42000): You have an error in your SQL syntax; check the manual that corresponds to your MySQL server version for the right syntax to use near ',"Fiction","Database","RDBMS","Others")
)' at line 6
mysql> create table books(
    -> book_no int primary key,
    -> book_name varchar(30) not null,
    -> author_name varchar(30),
    -> cost decimal(7,2),
    -> category char(10) check (category in ("System","Fiction","Database","RDBMS","Others"));
ERROR 1064 (42000): You have an error in your SQL syntax; check the manual that corresponds to your MySQL server version for the right syntax to use near '' at line 6
mysql> create table books(
    -> book_no int primary key,
    -> book_name varchar(30) not null,
    -> author_name varchar(30),
    -> cost decimal(7,2),
    -> category char(10) check (category in ("System","Fiction","Database","RDBMS","Others"))
    -> );
Query OK, 0 rows affected (0.03 sec)

mysql> desc books;
+-------------+--------------+------+-----+---------+-------+
| Field       | Type         | Null | Key | Default | Extra |
+-------------+--------------+------+-----+---------+-------+
| book_no     | int          | NO   | PRI | NULL    |       |
| book_name   | varchar(30)  | NO   |     | NULL    |       |
| author_name | varchar(30)  | YES  |     | NULL    |       |
| cost        | decimal(7,2) | YES  |     | NULL    |       |
| category    | char(10)     | YES  |     | NULL    |       |
+-------------+--------------+------+-----+---------+-------+
5 rows in set (0.00 sec)

mysql> insert into books
    -> values (101,"Let us C","Denis Ritchie",450,"System"),
    -> (102,"Oracle - Complete Ref","Loni",550,"Database"),
    -> (103,"Mastering SQL","Loni",250,"Database"),
    -> (104,"PL SQL-Ref","Scott Urman",750,"Database");
Query OK, 4 rows affected (0.01 sec)
Records: 4  Duplicates: 0  Warnings: 0

mysql> INSERT INTO books (book_no, book_name, author_name, cost, category) VALUES
    -> (105, 'Learning MySQL', 'John Smith', 45.99, 'Database'),
    -> (106, 'The Fictional World', 'Jane Doe', 25.50, 'Fiction'),
    -> (107, 'System Design Essentials', 'Tim Cook', 55.00, 'System'),
    -> (108, 'RDBMS Concepts', 'Alice Johnson', 60.75, 'RDBMS'),
    -> (109, 'Miscellaneous Reads', 'James Brown', 15.25, 'Others');
Query OK, 5 rows affected (0.05 sec)
Records: 5  Duplicates: 0  Warnings: 0

mysql> select * from members;
+-----------+---------------+----------------------------------+---------------+-----------------+-----------+-------------------+----------------+
| member_id | member_name   | member_address                   | acc_open_date | membership_type | fees_paid | max_books_allowed | penalty_amount |
+-----------+---------------+----------------------------------+---------------+-----------------+-----------+-------------------+----------------+
|         1 | Richa Sharma  | Pune                             | 2025-12-10    | Lifetime        |     25000 |                 5 |          50.00 |
|         2 | Garima Sen    | Pune                             | 2025-11-07    | Annual          |      1000 |                 3 |           NULL |
|         3 | Alice Johnson | 123 Maple St, Springfield        | 2023-01-15    | Lifetime        |      1000 |                10 |           0.00 |
|         4 | Bob Smith     | 456 Oak Ave, Shelbyville         | 2024-03-22    | Annual          |       300 |                 5 |          15.50 |
|         5 | Cathy Brown   | 789 Pine Rd, Ogdenville          | 2023-07-09    | Half Yearly     |       150 |                 7 |           5.00 |
|         6 | David Wilson  | 321 Elm St, Capital City         | 2025-02-10    | Quarterly       |        75 |                 3 |           0.00 |
|         7 | Emma Davis    | 654 Cedar Blvd, North Haverbrook | 2022-11-05    | Lifetime        |      1000 |                12 |          20.00 |
+-----------+---------------+----------------------------------+---------------+-----------------+-----------+-------------------+----------------+
7 rows in set (0.00 sec)

mysql> select * from books;
+---------+--------------------------+---------------+--------+----------+
| book_no | book_name                | author_name   | cost   | category |
+---------+--------------------------+---------------+--------+----------+
|     101 | Let us C                 | Denis Ritchie | 450.00 | System   |
|     102 | Oracle - Complete Ref    | Loni          | 550.00 | Database |
|     103 | Mastering SQL            | Loni          | 250.00 | Database |
|     104 | PL SQL-Ref               | Scott Urman   | 750.00 | Database |
|     105 | Learning MySQL           | John Smith    |  45.99 | Database |
|     106 | The Fictional World      | Jane Doe      |  25.50 | Fiction  |
|     107 | System Design Essentials | Tim Cook      |  55.00 | System   |
|     108 | RDBMS Concepts           | Alice Johnson |  60.75 | RDBMS    |
|     109 | Miscellaneous Reads      | James Brown   |  15.25 | Others   |
+---------+--------------------------+---------------+--------+----------+
9 rows in set (0.00 sec)

mysql> select * from issue;
ERROR 1146 (42S02): Table 'sqlassignment.issue' doesn't exist
mysql> insert into books
    -> values (110, "National Geographic","Adis Scott",1000,"Science");
ERROR 3819 (HY000): Check constraint 'books_chk_1' is violated.
mysql> show tables;
+-------------------------+
| Tables_in_sqlassignment |
+-------------------------+
| books                   |
| countries               |
| department              |
| employees               |
| job                     |
| job_histry              |
| jobs                    |
| lib_issue               |
| member101               |
| members                 |
+-------------------------+
10 rows in set (0.00 sec)

mysql> alter table lib_issue rename to issue;
Query OK, 0 rows affected (0.02 sec)

mysql> desc issue;
+--------------+------+------+-----+---------+-------+
| Field        | Type | Null | Key | Default | Extra |
+--------------+------+------+-----+---------+-------+
| lib_issue_id | int  | YES  |     | NULL    |       |
| book_no      | int  | YES  |     | NULL    |       |
| member_id    | int  | YES  |     | NULL    |       |
| issue_date   | date | YES  |     | NULL    |       |
| return_date  | date | YES  |     | NULL    |       |
+--------------+------+------+-----+---------+-------+
5 rows in set (0.00 sec)

mysql> drop table issue;
Query OK, 0 rows affected (0.07 sec)

mysql> create table issue(
    -> lib_issue_id int primary key,
    -> ;
ERROR 1064 (42000): You have an error in your SQL syntax; check the manual that corresponds to your MySQL server version for the right syntax to use near '' at line 2
mysql> desc books;
+-------------+--------------+------+-----+---------+-------+
| Field       | Type         | Null | Key | Default | Extra |
+-------------+--------------+------+-----+---------+-------+
| book_no     | int          | NO   | PRI | NULL    |       |
| book_name   | varchar(30)  | NO   |     | NULL    |       |
| author_name | varchar(30)  | YES  |     | NULL    |       |
| cost        | decimal(7,2) | YES  |     | NULL    |       |
| category    | char(10)     | YES  |     | NULL    |       |
+-------------+--------------+------+-----+---------+-------+
5 rows in set (0.00 sec)

mysql> desc members;
+-------------------+--------------+------+-----+---------+-------+
| Field             | Type         | Null | Key | Default | Extra |
+-------------------+--------------+------+-----+---------+-------+
| member_id         | int          | NO   | PRI | NULL    |       |
| member_name       | varchar(20)  | YES  |     | NULL    |       |
| member_address    | varchar(50)  | YES  |     | NULL    |       |
| acc_open_date     | date         | YES  |     | NULL    |       |
| membership_type   | varchar(20)  | YES  |     | NULL    |       |
| fees_paid         | int          | YES  |     | NULL    |       |
| max_books_allowed | int          | YES  |     | NULL    |       |
| penalty_amount    | decimal(7,2) | YES  |     | NULL    |       |
+-------------------+--------------+------+-----+---------+-------+
8 rows in set (0.00 sec)

mysql> create table issue(
    -> lib_issue_id int primary key,
    -> book_no int,
    -> member_id int,
    -> issue_date date,
    -> return date
    -> ,
    -> foreign key (book_no) references books(book_no),
    -> foreign key (member_id) references members(member_id)
    -> );
ERROR 1064 (42000): You have an error in your SQL syntax; check the manual that corresponds to your MySQL server version for the right syntax to use near 'return date
,
foreign key (book_no) references books(book_no),
foreign key (memb' at line 6
mysql> create table issue(
    -> lib_issue_id int primary key,
    -> book_no int,
    -> member_id int,
    -> issue_date date,
    -> return date,
    -> foreign key (book_no) references books(book_no),
    -> foreign key (member_id) references members(member_id)
    -> );
ERROR 1064 (42000): You have an error in your SQL syntax; check the manual that corresponds to your MySQL server version for the right syntax to use near 'return date,
foreign key (book_no) references books(book_no),
foreign key (membe' at line 6
mysql> create table issue(
    -> lib_issue_id int primary key,
    -> book_no int,
    -> member_id int,
    -> issue_date date,
    -> return_date date,
    -> foreign key (book_no) references books(book_no),
    -> foreign key (member_id) references members(member_id)
    -> );
Query OK, 0 rows affected (0.09 sec)

mysql> insert into issue
    -> values (7001,101,1,10-12-2006),
    -> (7002,102,2,25-11-2006),
    -> (7003,104,1,15-01-2006),
    -> (7004,101,1,04-06-2006),
    -> (7005,104,2,15-11-2006),
    -> (7006,101,3,18-02-2006);
ERROR 1136 (21S01): Column count doesn't match value count at row 1
mysql> insert into issue
    -> values (7001,101,1,"10-12-2006"),
    -> (7002,102,2,"25-11-2006"),
    -> (7003,104,1,"15-01-2006"),
    -> (7004,101,1,"04-06-2006"),
    -> (7005,104,2,"15-11-2006"),
    -> (7006,101,3,"18-02-2006");
ERROR 1136 (21S01): Column count doesn't match value count at row 1
mysql> insert into issue(lib_issue_id,book_no,member_id,issue_date)
    -> values (7001,101,1,"10-12-2006"),
    -> (7002,102,2,"25-11-2006"),
    -> (7003,104,1,"15-01-2006"),
    -> (7004,101,1,"04-06-2006"),
    -> (7005,104,2,"15-11-2006"),
    -> (7006,101,3,"18-02-2006");
ERROR 1292 (22007): Incorrect date value: '10-12-2006' for column 'issue_date' at row 1
mysql> insert into issue(lib_issue_id,book_no,member_id,issue_date)
    -> values (7001,101,1,10-12-2006),
    -> (7002,102,2,25-11-2006),
    -> (7003,104,1,15-01-2006),
    -> (7004,101,1,04-06-2006),
    -> (7005,104,2,15-11-2006),
    -> (7006,101,3,18-02-2006);
ERROR 1292 (22007): Incorrect date value: '-2008' for column 'issue_date' at row 1
mysql> INSERT INTO issue (lib_issue_id, book_no, member_id, issue_date) VALUES
    -> (7001, 101, 1, '2006-12-10'),
    -> (7002, 102, 2, '2006-11-25'),
    -> (7003, 104, 1, '2006-01-15'),
    -> (7004, 101, 1, '2006-06-04'),
    -> (7005, 104, 2, '2006-11-15'),
    -> (7006, 101, 3, '2006-02-18');
Query OK, 6 rows affected (0.01 sec)
Records: 6  Duplicates: 0  Warnings: 0

mysql> create show table issue;
ERROR 1064 (42000): You have an error in your SQL syntax; check the manual that corresponds to your MySQL server version for the right syntax to use near 'show table issue' at line 1
mysql> show create table issue;
+-------+----------------------------------------------------------------------------------------------------------------------------------------------------------------------------------------------------------------------------------------------------------------------------------------------------------------------------------------------------------------------------------------------------------------------------------------------------------------------------------------------------------------------------------------+
| Table | Create Table                                                                                                                                                                                                                                                                                                                                                                                                                                                                                                                           |
+-------+----------------------------------------------------------------------------------------------------------------------------------------------------------------------------------------------------------------------------------------------------------------------------------------------------------------------------------------------------------------------------------------------------------------------------------------------------------------------------------------------------------------------------------------+
| issue | CREATE TABLE `issue` (
  `lib_issue_id` int NOT NULL,
  `book_no` int DEFAULT NULL,
  `member_id` int DEFAULT NULL,
  `issue_date` date DEFAULT NULL,
  `return_date` date DEFAULT NULL,
  PRIMARY KEY (`lib_issue_id`),
  KEY `book_no` (`book_no`),
  KEY `member_id` (`member_id`),
  CONSTRAINT `issue_ibfk_1` FOREIGN KEY (`book_no`) REFERENCES `books` (`book_no`),
  CONSTRAINT `issue_ibfk_2` FOREIGN KEY (`member_id`) REFERENCES `members` (`member_id`)
) ENGINE=InnoDB DEFAULT CHARSET=utf8mb4 COLLATE=utf8mb4_0900_ai_ci |
+-------+----------------------------------------------------------------------------------------------------------------------------------------------------------------------------------------------------------------------------------------------------------------------------------------------------------------------------------------------------------------------------------------------------------------------------------------------------------------------------------------------------------------------------------------+
1 row in set (0.00 sec)

mysql> table members;
+-----------+---------------+----------------------------------+---------------+-----------------+-----------+-------------------+----------------+
| member_id | member_name   | member_address                   | acc_open_date | membership_type | fees_paid | max_books_allowed | penalty_amount |
+-----------+---------------+----------------------------------+---------------+-----------------+-----------+-------------------+----------------+
|         1 | Richa Sharma  | Pune                             | 2025-12-10    | Lifetime        |     25000 |                 5 |          50.00 |
|         2 | Garima Sen    | Pune                             | 2025-11-07    | Annual          |      1000 |                 3 |           NULL |
|         3 | Alice Johnson | 123 Maple St, Springfield        | 2023-01-15    | Lifetime        |      1000 |                10 |           0.00 |
|         4 | Bob Smith     | 456 Oak Ave, Shelbyville         | 2024-03-22    | Annual          |       300 |                 5 |          15.50 |
|         5 | Cathy Brown   | 789 Pine Rd, Ogdenville          | 2023-07-09    | Half Yearly     |       150 |                 7 |           5.00 |
|         6 | David Wilson  | 321 Elm St, Capital City         | 2025-02-10    | Quarterly       |        75 |                 3 |           0.00 |
|         7 | Emma Davis    | 654 Cedar Blvd, North Haverbrook | 2022-11-05    | Lifetime        |      1000 |                12 |          20.00 |
+-----------+---------------+----------------------------------+---------------+-----------------+-----------+-------------------+----------------+
7 rows in set (0.00 sec)

mysql> table issue;
+--------------+---------+-----------+------------+-------------+
| lib_issue_id | book_no | member_id | issue_date | return_date |
+--------------+---------+-----------+------------+-------------+
|         7001 |     101 |         1 | 2006-12-10 | NULL        |
|         7002 |     102 |         2 | 2006-11-25 | NULL        |
|         7003 |     104 |         1 | 2006-01-15 | NULL        |
|         7004 |     101 |         1 | 2006-06-04 | NULL        |
|         7005 |     104 |         2 | 2006-11-15 | NULL        |
|         7006 |     101 |         3 | 2006-02-18 | NULL        |
+--------------+---------+-----------+------------+-------------+
6 rows in set (0.00 sec)

mysql> alter table issue
    -> drop foreign key ("issue_ibfk_1","issue_ibfk_2");
ERROR 1064 (42000): You have an error in your SQL syntax; check the manual that corresponds to your MySQL server version for the right syntax to use near '("issue_ibfk_1","issue_ibfk_2")' at line 2
mysql> alter table issue
    -> drop foreign key "issue_ibfk_1",
    -> drop foreign key "issue_ibfk_2";
ERROR 1064 (42000): You have an error in your SQL syntax; check the manual that corresponds to your MySQL server version for the right syntax to use near '"issue_ibfk_1",
drop foreign key "issue_ibfk_2"' at line 2
mysql> alter table issue
    -> drop foreign key issue_ibfk_1,
    -> drop foreign key issue_ibfk_2;
Query OK, 0 rows affected (0.06 sec)
Records: 0  Duplicates: 0  Warnings: 0

mysql> show create table issue;
+-------+----------------------------------------------------------------------------------------------------------------------------------------------------------------------------------------------------------------------------------------------------------------------------------------------------------------------------------------------------------+
| Table | Create Table                                                                                                                                                                                                                                                                                                                                             |
+-------+----------------------------------------------------------------------------------------------------------------------------------------------------------------------------------------------------------------------------------------------------------------------------------------------------------------------------------------------------------+
| issue | CREATE TABLE `issue` (
  `lib_issue_id` int NOT NULL,
  `book_no` int DEFAULT NULL,
  `member_id` int DEFAULT NULL,
  `issue_date` date DEFAULT NULL,
  `return_date` date DEFAULT NULL,
  PRIMARY KEY (`lib_issue_id`),
  KEY `book_no` (`book_no`),
  KEY `member_id` (`member_id`)
) ENGINE=InnoDB DEFAULT CHARSET=utf8mb4 COLLATE=utf8mb4_0900_ai_ci |
+-------+----------------------------------------------------------------------------------------------------------------------------------------------------------------------------------------------------------------------------------------------------------------------------------------------------------------------------------------------------------+
1 row in set (0.00 sec)

mysql> desc issue;
+--------------+------+------+-----+---------+-------+
| Field        | Type | Null | Key | Default | Extra |
+--------------+------+------+-----+---------+-------+
| lib_issue_id | int  | NO   | PRI | NULL    |       |
| book_no      | int  | YES  | MUL | NULL    |       |
| member_id    | int  | YES  | MUL | NULL    |       |
| issue_date   | date | YES  |     | NULL    |       |
| return_date  | date | YES  |     | NULL    |       |
+--------------+------+------+-----+---------+-------+
5 rows in set (0.00 sec)

mysql> table members;
+-----------+---------------+----------------------------------+---------------+-----------------+-----------+-------------------+----------------+
| member_id | member_name   | member_address                   | acc_open_date | membership_type | fees_paid | max_books_allowed | penalty_amount |
+-----------+---------------+----------------------------------+---------------+-----------------+-----------+-------------------+----------------+
|         1 | Richa Sharma  | Pune                             | 2025-12-10    | Lifetime        |     25000 |                 5 |          50.00 |
|         2 | Garima Sen    | Pune                             | 2025-11-07    | Annual          |      1000 |                 3 |           NULL |
|         3 | Alice Johnson | 123 Maple St, Springfield        | 2023-01-15    | Lifetime        |      1000 |                10 |           0.00 |
|         4 | Bob Smith     | 456 Oak Ave, Shelbyville         | 2024-03-22    | Annual          |       300 |                 5 |          15.50 |
|         5 | Cathy Brown   | 789 Pine Rd, Ogdenville          | 2023-07-09    | Half Yearly     |       150 |                 7 |           5.00 |
|         6 | David Wilson  | 321 Elm St, Capital City         | 2025-02-10    | Quarterly       |        75 |                 3 |           0.00 |
|         7 | Emma Davis    | 654 Cedar Blvd, North Haverbrook | 2022-11-05    | Lifetime        |      1000 |                12 |          20.00 |
+-----------+---------------+----------------------------------+---------------+-----------------+-----------+-------------------+----------------+
7 rows in set (0.00 sec)

mysql>
mysql> insert into issue
    -> values (7007,101,999,'2006-03-06');
ERROR 1136 (21S01): Column count doesn't match value count at row 1
mysql> insert into issue(lib_issue_id,book_no,member_id,issue_date)
    -> values (7007,101,999,'2006-03-06');
Query OK, 1 row affected (0.01 sec)

mysql> table issue;
+--------------+---------+-----------+------------+-------------+
| lib_issue_id | book_no | member_id | issue_date | return_date |
+--------------+---------+-----------+------------+-------------+
|         7001 |     101 |         1 | 2006-12-10 | NULL        |
|         7002 |     102 |         2 | 2006-11-25 | NULL        |
|         7003 |     104 |         1 | 2006-01-15 | NULL        |
|         7004 |     101 |         1 | 2006-06-04 | NULL        |
|         7005 |     104 |         2 | 2006-11-15 | NULL        |
|         7006 |     101 |         3 | 2006-02-18 | NULL        |
|         7007 |     101 |       999 | 2006-03-06 | NULL        |
+--------------+---------+-----------+------------+-------------+
7 rows in set (0.00 sec)

mysql> alter table issue
    -> add constraint fk_bookNo foreign key (book_no) references books(book_no),
    -> add constraint fk_memberId foreign key (member_id) references members(member_id);
ERROR 1452 (23000): Cannot add or update a child row: a foreign key constraint fails (`sqlassignment`.`#sql-15e0_d`, CONSTRAINT `fk_memberId` FOREIGN KEY (`member_id`) REFERENCES `members` (`member_id`))
mysql> delete from issue where lib_issue_id = 7007;
Query OK, 1 row affected (0.01 sec)

mysql> table members;
+-----------+---------------+----------------------------------+---------------+-----------------+-----------+-------------------+----------------+
| member_id | member_name   | member_address                   | acc_open_date | membership_type | fees_paid | max_books_allowed | penalty_amount |
+-----------+---------------+----------------------------------+---------------+-----------------+-----------+-------------------+----------------+
|         1 | Richa Sharma  | Pune                             | 2025-12-10    | Lifetime        |     25000 |                 5 |          50.00 |
|         2 | Garima Sen    | Pune                             | 2025-11-07    | Annual          |      1000 |                 3 |           NULL |
|         3 | Alice Johnson | 123 Maple St, Springfield        | 2023-01-15    | Lifetime        |      1000 |                10 |           0.00 |
|         4 | Bob Smith     | 456 Oak Ave, Shelbyville         | 2024-03-22    | Annual          |       300 |                 5 |          15.50 |
|         5 | Cathy Brown   | 789 Pine Rd, Ogdenville          | 2023-07-09    | Half Yearly     |       150 |                 7 |           5.00 |
|         6 | David Wilson  | 321 Elm St, Capital City         | 2025-02-10    | Quarterly       |        75 |                 3 |           0.00 |
|         7 | Emma Davis    | 654 Cedar Blvd, North Haverbrook | 2022-11-05    | Lifetime        |      1000 |                12 |          20.00 |
+-----------+---------------+----------------------------------+---------------+-----------------+-----------+-------------------+----------------+
7 rows in set (0.00 sec)

mysql> delete from members
    -> where member_id = 1;
Query OK, 1 row affected (0.05 sec)

mysql> desc member;
ERROR 1146 (42S02): Table 'sqlassignment.member' doesn't exist
mysql> desc members;
+-------------------+--------------+------+-----+---------+-------+
| Field             | Type         | Null | Key | Default | Extra |
+-------------------+--------------+------+-----+---------+-------+
| member_id         | int          | NO   | PRI | NULL    |       |
| member_name       | varchar(20)  | YES  |     | NULL    |       |
| member_address    | varchar(50)  | YES  |     | NULL    |       |
| acc_open_date     | date         | YES  |     | NULL    |       |
| membership_type   | varchar(20)  | YES  |     | NULL    |       |
| fees_paid         | int          | YES  |     | NULL    |       |
| max_books_allowed | int          | YES  |     | NULL    |       |
| penalty_amount    | decimal(7,2) | YES  |     | NULL    |       |
+-------------------+--------------+------+-----+---------+-------+
8 rows in set (0.00 sec)

mysql> table members
    -> ;
+-----------+---------------+----------------------------------+---------------+-----------------+-----------+-------------------+----------------+
| member_id | member_name   | member_address                   | acc_open_date | membership_type | fees_paid | max_books_allowed | penalty_amount |
+-----------+---------------+----------------------------------+---------------+-----------------+-----------+-------------------+----------------+
|         2 | Garima Sen    | Pune                             | 2025-11-07    | Annual          |      1000 |                 3 |           NULL |
|         3 | Alice Johnson | 123 Maple St, Springfield        | 2023-01-15    | Lifetime        |      1000 |                10 |           0.00 |
|         4 | Bob Smith     | 456 Oak Ave, Shelbyville         | 2024-03-22    | Annual          |       300 |                 5 |          15.50 |
|         5 | Cathy Brown   | 789 Pine Rd, Ogdenville          | 2023-07-09    | Half Yearly     |       150 |                 7 |           5.00 |
|         6 | David Wilson  | 321 Elm St, Capital City         | 2025-02-10    | Quarterly       |        75 |                 3 |           0.00 |
|         7 | Emma Davis    | 654 Cedar Blvd, North Haverbrook | 2022-11-05    | Lifetime        |      1000 |                12 |          20.00 |
+-----------+---------------+----------------------------------+---------------+-----------------+-----------+-------------------+----------------+
6 rows in set (0.00 sec)

mysql> desc books;
+-------------+--------------+------+-----+---------+-------+
| Field       | Type         | Null | Key | Default | Extra |
+-------------+--------------+------+-----+---------+-------+
| book_no     | int          | NO   | PRI | NULL    |       |
| book_name   | varchar(30)  | NO   |     | NULL    |       |
| author_name | varchar(30)  | YES  |     | NULL    |       |
| cost        | decimal(7,2) | YES  |     | NULL    |       |
| category    | char(10)     | YES  |     | NULL    |       |
+-------------+--------------+------+-----+---------+-------+
5 rows in set (0.00 sec)

mysql> table books;
+---------+--------------------------+---------------+--------+----------+
| book_no | book_name                | author_name   | cost   | category |
+---------+--------------------------+---------------+--------+----------+
|     101 | Let us C                 | Denis Ritchie | 450.00 | System   |
|     102 | Oracle - Complete Ref    | Loni          | 550.00 | Database |
|     103 | Mastering SQL            | Loni          | 250.00 | Database |
|     104 | PL SQL-Ref               | Scott Urman   | 750.00 | Database |
|     105 | Learning MySQL           | John Smith    |  45.99 | Database |
|     106 | The Fictional World      | Jane Doe      |  25.50 | Fiction  |
|     107 | System Design Essentials | Tim Cook      |  55.00 | System   |
|     108 | RDBMS Concepts           | Alice Johnson |  60.75 | RDBMS    |
|     109 | Miscellaneous Reads      | James Brown   |  15.25 | Others   |
+---------+--------------------------+---------------+--------+----------+
9 rows in set (0.00 sec)

mysql> desc issue;
+--------------+------+------+-----+---------+-------+
| Field        | Type | Null | Key | Default | Extra |
+--------------+------+------+-----+---------+-------+
| lib_issue_id | int  | NO   | PRI | NULL    |       |
| book_no      | int  | YES  | MUL | NULL    |       |
| member_id    | int  | YES  | MUL | NULL    |       |
| issue_date   | date | YES  |     | NULL    |       |
| return_date  | date | YES  |     | NULL    |       |
+--------------+------+------+-----+---------+-------+
5 rows in set (0.00 sec)

mysql> table issue;
+--------------+---------+-----------+------------+-------------+
| lib_issue_id | book_no | member_id | issue_date | return_date |
+--------------+---------+-----------+------------+-------------+
|         7001 |     101 |         1 | 2006-12-10 | NULL        |
|         7002 |     102 |         2 | 2006-11-25 | NULL        |
|         7003 |     104 |         1 | 2006-01-15 | NULL        |
|         7004 |     101 |         1 | 2006-06-04 | NULL        |
|         7005 |     104 |         2 | 2006-11-15 | NULL        |
|         7006 |     101 |         3 | 2006-02-18 | NULL        |
+--------------+---------+-----------+------------+-------------+
6 rows in set (0.00 sec)

mysql> update issue
    -> set return_date = date_add(issue_date, interval 15 days)
    -> where issue_date in (7004,7005);
ERROR 1064 (42000): You have an error in your SQL syntax; check the manual that corresponds to your MySQL server version for the right syntax to use near 'days)
where issue_date in (7004,7005)' at line 2
mysql> update issue
    -> set return_date = date_add(issue_date, interval 15 day)
    -> where issue_date in (7004,7005);
ERROR 1292 (22007): Incorrect date value: '7004' for column 'issue_date' at row 1
mysql> update issue
    -> set return_date = date_add(issue_date, interval 15 days)
    -> where lib_issue_id in (7004,7005);
ERROR 1064 (42000): You have an error in your SQL syntax; check the manual that corresponds to your MySQL server version for the right syntax to use near 'days)
where lib_issue_id in (7004,7005)' at line 2
mysql> update issue
    -> set return_date = date_add(issue_date, interval 15 day)
    -> where lib_issue_id in (7004,7005);
Query OK, 2 rows affected (0.01 sec)
Rows matched: 2  Changed: 2  Warnings: 0

mysql> delete from issue
    -> where member_id = 1 and issue_date < '2006-12-06';
Query OK, 2 rows affected (0.05 sec)

mysql> delete from books
    -> where category not in ("RDBMS","Database");
Query OK, 4 rows affected (0.05 sec)

mysql> drop table members;
Query OK, 0 rows affected (0.07 sec)

mysql> drop table books;
Query OK, 0 rows affected (0.02 sec)

mysql>